{
  "id": "P-TOKEN-SHAPE-v0",
  "version": "0.1",
  "description": "Case 1 partial: compare token-endpoint shape fields under matched grant+scopes. Lab uses resource-owner password grant (not the programme auth-code+PKCE baseline). Does NOT exercise refresh reuse or rotation — that belongs to P-REFRESH-REUSE-v0 when that spine is run.",
  "flow": "resource_owner_password",
  "spine": "token_endpoint_shape",
  "client": {
    "client_id": "itl-lab-client",
    "pkce": false
  },
  "perturbations": [],
  "assertions": [
    {
      "feature": "password_grant_openid_issues_tokens",
      "expected": "HTTP 200, Bearer, refresh issued, id_token contains sub"
    },
    {
      "feature": "access_token_is_jwt",
      "expected": "JWT-ness of access token compared only after config equivalence for JWT access tokens"
    },
    {
      "feature": "token_lifetime_expires_in",
      "expected": "expires_in compared only after access-token lifetimes are equated"
    }
  ]
}
